id,title,release_date,vote_average,vote_count,popularity,original_language,overview,runtime,budget,revenue,top_actors
515001,Jojo Rabbit,2019-10-18,8.01,9783,45.5519,en,"A World War II satire that follows a lonely German boy whose world view is turned upside down when he discovers his single mother is hiding a young Jewish girl in their attic. Aided only by his idiotic imaginary friend, Adolf Hitler, Jojo must confront his blind nationalism.",108,14000000,82468705,"Roman Griffin Davis, Thomasin McKenzie, Scarlett Johansson"
1217690,Homestead,2024-12-19,5.902,41,45.7687,en,"A nuclear bomb is detonated in Los Angeles, and the nation devolves into unprecedented chaos. Ex-Green Beret Jeff Eriksson and his family escape to The Homestead, an eccentric prepper’s fortress nestled in the mountains. As violent threats and apocalyptic conditions creep toward their borders, the residents of The Homestead are left to wonder: how long can a group of people resist both the dangers of human nature and the bloodshed at their doorstep?",111,5000000,20811864,"Dawn Olivieri, Neal McDonough, Susan Misner"
238,The Godfather,1972-03-14,8.687,21413,47.8916,en,"Spanning the years 1945 to 1955, a chronicle of the fictional Italian-American Corleone crime family. When organized crime family patriarch, Vito Corleone barely survives an attempt on his life, his youngest son, Michael steps in to take care of the would-be killers, launching a campaign of bloody revenge.",175,6000000,245066411,"Marlon Brando, Al Pacino, James Caan"
1373723,The Codes of War,2025-03-20,6.117,60,44.6834,en,"War stories about family, ethics and honor include the true story of two U.S. Marines who in a span of six seconds, must stand their ground to stop a suicide truck bomb, a Navy Corpsman who attempts to hold on to his humanity, and a WW2 soldier who gets separated from his squad and is forced to re-evaluate his code.",92,0,0,"Noah Gray-Cabey, Michael Grant"
1184918,The Wild Robot,2024-09-12,8.319,4861,45.2517,en,"After a shipwreck, an intelligent robot called Roz is stranded on an uninhabited island. To survive the harsh environment, Roz bonds with the island's animals and cares for an orphaned baby goose.",102,78000000,331982078,"Lupita Nyong'o, Pedro Pascal, Kit Connor"
539972,Kraven the Hunter,2024-12-11,6.583,1650,45.5352,en,"Kraven Kravinoff's complex relationship with his ruthless gangster father, Nikolai, starts him down a path of vengeance with brutal consequences, motivating him to become not only the greatest hunter in the world, but also one of its most feared.",127,120000000,59184643,"Aaron Taylor-Johnson, Ariana DeBose, Fred Hechinger"
39843,Red to Kill,1994-10-20,6.2,25,31.0004,cn,"A serial rapist rapes a girl with mental disability for wearing a red dress, which triggers him. Now the girl's social worker vows to get revenge on the rapist.",91,0,0,"Lily Chung Suk-Wai, Money Lo Man-Yee, Ben Ng Ngai-Cheung"
1055451,Founders Day,2024-01-19,4.541,49,40.6697,en,A small town is shaken by a series of ominous killings in the days leading up to a heated mayoral election.,107,0,0,"Naomi Grace, Devin Druid, William Russ"
372058,Your Name.,2016-08-26,8.484,11748,42.8376,ja,"High schoolers Mitsuha and Taki are complete strangers living separate lives. But one night, they suddenly switch places. Mitsuha wakes up in Taki’s body, and he in hers. This bizarre occurrence continues to happen randomly, and the two must adjust their lives around each other.",106,0,358000000,"Ryunosuke Kamiki, Mone Kamishiraishi, Ryo Narita"
872585,Oppenheimer,2023-07-19,8.061,10194,45.6401,en,The story of J. Robert Oppenheimer's role in the development of the atomic bomb during World War II.,181,100000000,952000000,"Cillian Murphy, Emily Blunt, Matt Damon"
696506,Mickey 17,2025-02-28,6.896,1857,44.6549,en,"Unlikely hero Mickey Barnes finds himself in the extraordinary circumstance of working for an employer who demands the ultimate commitment to the job… to die, for a living.",137,118000000,131847147,"Robert Pattinson, Naomi Ackie, Steven Yeun"
1022789,Inside Out 2,2024-06-11,7.6,5809,44.5751,en,"Teenager Riley's mind headquarters is undergoing a sudden demolition to make room for something entirely unexpected: new Emotions! Joy, Sadness, Anger, Fear and Disgust, who’ve long been running a successful operation by all accounts, aren’t sure how to feel when Anxiety shows up. And it looks like she’s not alone.",97,200000000,1698863816,"Amy Poehler, Maya Hawke, Kensington Tallman"
1011477,Karate Kid: Legends,2025-05-08,9.667,3,45.742,en,"After a family tragedy, kung fu prodigy Li Fong is uprooted from his home in Beijing and forced to move to New York City with his mother. When a new friend needs his help, Li enters a karate competition – but his skills alone aren't enough. Li's kung fu teacher Mr. Han enlists original Karate Kid Daniel LaRusso for help, and Li learns a new way to fight, merging their two styles into one for the ultimate martial arts showdown.",94,0,0,"Ben Wang, Jackie Chan, Ralph Macchio"
1083968,Locked,2025-03-20,6.2,115,45.7284,en,"When Eddie breaks into a luxury SUV, he steps into a deadly trap set by William, a self-proclaimed vigilante delivering his own brand of twisted justice. With no means of escape, Eddie must fight to survive in a ride where escape is an illusion, survival is a nightmare, and justice shifts into high gear.",95,0,3,"Bill Skarsgård, Anthony Hopkins, Ashley Cartwright"
760497,The Match,2025-03-26,8.0,5,45.5615,ko,"When a legendary Go master loses his title to a one-time friend and protégé, he sets out to reclaim it in a high-stakes battle of wits and skill.",115,0,0,"Lee Byung-hun, Yoo Ah-in, Moon Jeong-hee"
919207,12.12: The Day,2023-11-22,7.5,110,40.9932,ko,"After the assassination of President Park, martial law has been declared. A coup d'état bursts out by DefenseSecurity Commander Chun Doo-gwang and a private band of officers following him. Capital Defense Commander Lee Tae-shin, an obstinate soldier who believes the military should not take political actions, fights against Chun Doo-gwang to stop him. The conflict between the two grows while military leaders are holding their decision and Defense Minister is gone. In the midst of chaos, the spring of Seoul that everyone longed for heads to unexpected direction.",142,0,0,"Hwang Jung-min, Jung Woo-sung, Lee Sung-min"
558449,Gladiator II,2024-11-13,6.7,3293,41.6454,en,"Years after witnessing the death of the revered hero Maximus at the hands of his uncle, Lucius is forced to enter the Colosseum after his home is conquered by the tyrannical Emperors who now lead Rome with an iron fist. With rage in his heart and the future of the Empire at stake, Lucius must look to his past to find strength and honor to return the glory of Rome to its people.",148,310000000,458718000,"Paul Mescal, Denzel Washington, Pedro Pascal"
1064486,Memoir of a Snail,2024-10-17,8.053,475,45.0249,en,"Forcibly separated from her twin brother when they are orphaned, a melancholic misfit learns how to find confidence within herself amid the clutter of misfortunes and everyday life.",94,4350000,6780428,"Sarah Snook, Kodi Smit-McPhee, Jacki Weaver"
968171,Sex Education Mistresses,1973-11-20,5.9,5,53.1087,ja,"An erotic comedy depicting the sex adventures of  young wives living in an apartment complex, that are not satisfied with just having sex with their husbands.",78,0,0,"Michiko Tsukasa, Rie Nakagawa, Yūko Katagiri"
1377424,Victoria,2024-12-14,5.0,1,44.1854,ml,"Victoria, a young beautician in a suburban beauty parlour, decides to elope with her Hindu boyfriend after a fierce clash with her conservative Catholic parents. Amidst the turmoil, a neighbour asks her to temporarily house an offering rooster destined for a festival at St. George church inside the parlour. Juggling the rooster's antics, unexpected clients, and her boyfriend's uncertainty, Victoria grapples with conflicting emotions leading to a day of intense personal and spiritual revelations.",84,0,0,"Meenakshi Jayan, Sreeshma Chandran, Jolly Chirayath"
650033,Free Fall,2025-05-14,7.5,2,44.6489,ru,"In the near future, humanity has successfully colonized space and build a giant orbital station ""Delta"". Max is a repairman working on the station. After a disaster caused by a proton storm, he is left alone without his crew members, drifting into space. His space suit is broken, he is exhausted, and he lacks communication with people. But suddenly a dispatcher named Anna comes to help. She is the only one who can guide Max through difficulties and get him to the station. Max has to risk everything to save his life, but he has no idea what Anna is up to.",90,0,0,"Aleksandr Kuznetsov, Anya Chipovskaya, Andrey Merzlikin"
933260,The Substance,2024-09-07,7.1,4549,43.8228,en,"A fading celebrity decides to use a black market drug, a cell-replicating substance that temporarily creates a younger, better version of herself.",141,17500000,76506196,"Demi Moore, Margaret Qualley, Dennis Quaid"
927342,Amaran,2024-10-31,7.383,227,41.6084,ta,"A heroic true story of Major Mukund Varadarajan, an Indian Army officer who displayed extraordinary bravery during a counterterrorism mission in Kashmir’s Shopian district. The film captures his courage in protecting his nation and the devotion of his wife Indhu Rebecaa Varghese.",169,14700000,39200000,"Sivakarthikeyan, Sai Pallavi, Rahul Bose"
1356039,Counterattack,2025-02-27,8.369,668,40.0646,es,"When a hostage rescue mission creates a new enemy, Capt. Guerrero and his elite soldiers must face an ambush by a criminal group.",85,0,0,"Luis Alberti, Noé Hernández, Leonardo Alonso"
447332,A Quiet Place,2018-04-03,7.4,14530,37.3234,en,A family is forced to live in silence while hiding from creatures that hunt by sound.,91,17000000,340955294,"Emily Blunt, John Krasinski, Millicent Simmonds"
300668,Annihilation,2018-02-22,6.426,8829,37.7261,en,"A biologist signs up for a dangerous, secret expedition into a mysterious zone where the laws of nature don't apply.",115,40000000,43070915,"Natalie Portman, Jennifer Jason Leigh, Gina Rodriguez"
823219,Flow,2024-08-29,8.2,1904,41.3645,lv,"A solitary cat, displaced by a great flood, finds refuge on a boat with various species and must navigate the challenges of adapting to a transformed world together.",85,3700000,17660107,
693134,Dune: Part Two,2024-02-27,8.149,6621,38.8733,en,"Follow the mythic journey of Paul Atreides as he unites with Chani and the Fremen while on a path of revenge against the conspirators who destroyed his family. Facing a choice between the love of his life and the fate of the known universe, Paul endeavors to prevent a terrible future only he can foresee.",167,190000000,714444358,"Timothée Chalamet, Zendaya, Rebecca Ferguson"
419430,Get Out,2017-02-24,7.6,17846,38.0727,en,"Chris and his girlfriend Rose go upstate to visit her parents for the weekend. At first, Chris reads the family's overly accommodating behavior as nervous attempts to deal with their daughter's interracial relationship, but as the weekend progresses, a series of increasingly disturbing discoveries lead him to a truth that he never could have imagined.",104,4500000,255407969,"Daniel Kaluuya, Allison Williams, Catherine Keener"
502356,The Super Mario Bros. Movie,2023-04-05,7.622,9661,39.6029,en,"While working underground to fix a water main, Brooklyn plumbers—and brothers—Mario and Luigi are transported down a mysterious pipe and wander into a magical new world. But when the brothers are separated, Mario embarks on an epic quest to find Luigi.",93,100000000,1362000000,"Chris Pratt, Anya Taylor-Joy, Charlie Day"
7451,xXx,2002-08-09,5.942,4409,40.1828,en,"Xander Cage is your standard adrenaline junkie with no fear and a lousy attitude. When the US Government ""recruits"" him to go on a mission, he's not exactly thrilled. His mission: to gather information on an organization that may just be planning the destruction of the world, led by the nihilistic Yorgi.",124,70000000,277448382,"Vin Diesel, Asia Argento, Marton Csokas"
